title,title_url,info,img_url
“周到”、“合群”、“圆滑”等用英语怎么说？,http://language.chinadaily.com.cn/a/202205/12/WS627cc9b4a310fd2b29e5c4b6.html,汉语里各种用来形容人的处事风格和性格特点的词语，如“周到”、“合群”、“真实”、“圆滑”、“装”、“假惺惺”等在英语中有没有对应的说法？,http://img2.chinadaily.com.cn/images/202205/12/627cc9b4a310fd2bec889b2a.jpeg
每日新闻播报（May 12）,http://language.chinadaily.com.cn/a/202205/12/WS627ca781a310fd2b29e5c42d.html,今日播报内容：4月份CPI同比上涨2.1%；两部门拟修订鼓励外商投资产业目录；专家：中国有望实现全年经济增长目标；我国60岁以上老年人群接种率不断提升。,http://img2.chinadaily.com.cn/images/202205/12/627ca781a310fd2bec8889ba.jpeg
专家：今年通胀水平总体温和可控,http://language.chinadaily.com.cn/a/202205/12/WS627c9608a310fd2b29e5c407.html,国家统计局日前发布的数据显示，4月份全国居民消费价格指数同比上涨2.1%，创下五个月来的最大涨幅。,http://img2.chinadaily.com.cn/images/202205/12/627c9608a310fd2bec888718.jpeg
缺货率高达40%！美国婴幼儿奶粉危机引发恐慌,http://language.chinadaily.com.cn/a/202205/12/WS627c5511a310fd2b29e5c1af.html,"美国各地商店的畅销婴儿配方奶粉被抢购一空，平均缺货率高达40%，大型连锁药店纷纷实行限购措施。

",http://img2.chinadaily.com.cn/images/202205/12/627c5511a310fd2bec8861ab.jpeg
一课译词：断断续续,http://language.chinadaily.com.cn/a/202205/11/WS627b814fa310fd2b29e5c0c7.html,“断断续续”，汉语词语，意思是时而中断，时而继续。可以翻译为“ intermittently，off and on”。,http://img2.chinadaily.com.cn/images/202205/11/627b8181a310fd2bec8850b5.jpeg
央行货币政策加大对实体经济支持力度,http://language.chinadaily.com.cn/a/202205/11/WS627b7c90a310fd2b29e5c0ba.html,央行将发挥存款利率市场化调整机制的“重要作用”，完善市场化利率形成，推动降低企业综合融资成本。,http://img2.chinadaily.com.cn/images/202205/11/627b7c90a310fd2bec884f7e.jpeg
每日一词∣以县城为重要载体的城镇化建设 urbanization with a focus on county towns,http://language.chinadaily.com.cn/a/202205/11/WS627b7b19a310fd2b29e5c0a8.html,近日，中共中央办公厅、国务院办公厅印发了《关于推进以县城为重要载体的城镇化建设的意见》。《意见》明确，到2025年，以县城为重要载体的城镇化建设取得重要进展。,http://img2.chinadaily.com.cn/images/202205/11/627b7b19a310fd2bec884dd9.jpeg
每日新闻播报（May 11）,http://language.chinadaily.com.cn/a/202205/11/WS627b5faaa310fd2b29e5c033.html,今日播报内容：天舟四号货运飞船成功发射；今年前4个月我国外贸增长7.9%；2025年全国护士总数达到550万人；去年中国沿海海平面较常年高84毫米。,http://img2.chinadaily.com.cn/images/202205/11/627b5faaa310fd2bec8846d2.jpeg
TED演讲：对完美的追求正在毁了年轻人,http://language.chinadaily.com.cn/a/202205/11/WS627b1032a310fd2b29e5be4c.html,如果我们告诉年轻人，在生活中没有比追求虚妄的完美更重要的事，那么我们就会让一代代的年轻人都遭受徒劳和绝望。,http://img2.chinadaily.com.cn/images/202205/11/627b1032a310fd2bec882fc1.jpeg
